Include,posted_iso,Author,Headline,Summary,Tags,post_url
Y,3mo,Carlo Angeles,The Silent Collapse: Accelerating Global Decline of Terrestrial Insects and Ecosystem Impacts,"Carlo Angeles highlights the alarming global decline of terrestrial insects at an average rate of 9% per decade, with over 75% reductions in biomass observed in protected areas in Germany and the Netherlands. This 'silent collapse' is driven by habitat loss, pesticides, light pollution, climate disruption, and land degradation. The decline of insects, which are crucial pollinators, soil builders, and decomposers, has ripple effects across ecosystems, impacting plants, birds, fish, and ultimately food security and human life. Angeles emphasizes the urgency for collective and systemic changes rather than solely focusing on individual behavior.","Biodiversity, Impacts, Science, Policies and Measures",https://www.linkedin.com/posts/angelescarlo_the-silent-collapse-is-accelerating-activity-7326236983343673344-Ly2E
Y,3mo,Markus Leippold,Empirical Evidence: Mandatory Climate Disclosure Enhances Reporting Quality and ESG Performance,"Markus Leippold shares new research demonstrating that mandatory climate disclosure significantly increases both the quantity and quality of climate reporting, particularly for corporate issuers. The study, focusing on New Zealand's world-first TCFD/ISSB-aligned mandate, found that fund managers improved portfolio ESG performance and reduced carbon intensities. While challenges like data reliability and metrics complexity remain, the evidence supports the effectiveness of mandatory disclosure frameworks in enhancing transparency. However, Mark Baker-Jones comments that the improvement might be surface-level compliance rather than deep integration of climate risk into financial understanding and decision-making.","Climate Risk, Risk Disclosure, ESG, Policies and Measures, Economics",https://www.linkedin.com/posts/markus-leippold-578bb95_newzealand-climatedisclosure-esg-activity-7326142855347933185-hp9a
Y,3mo,Matthew Phillips,Transforming the Climate Movement: A 'House Party' Approach for Collective Momentum,"Matthew Phillips announces his TED Talk, 'What if the climate movement felt like a house party?', which addresses the fragmented state of the climate movement and proposes building a truly inclusive 'house'. He advocates for balancing optimism with realism, empowering a new economy by supporting organizations through challenges, and harnessing the power of art and culture to reach beyond eco-echo-chambers. Phillips notes that 80% of people worldwide want climate action but the movement has failed to make it personally resonant for this global supermajority, highlighting efforts like Mission 2025 to coordinate voices and support Brazil's COP30.","Communications, Psychology, Policies and Measures, Energy Transition, Impacts",https://www.linkedin.com/posts/matthew-phillips-16aa9054_matthew-phillips-what-if-the-climate-movement-activity-7329170179794309120-abXD/
Y,3mo,Robert Vautard,The Enduring Need for Physical Climate Science in IPCC Reports and Climate Transitions,"Robert Vautard reflects on the continuing need for the IPCC Working Group I (WGI) Physical Science Report, having initially doubted its utility for governments' transition efforts. He now believes physical climate science will deliver novel, powerful messages and can widen its reach through improved communication, fostering trust in a low-carbon future and equity. Vautard highlights the accelerating global warming, new key observations, and the need to understand extreme anomalies, reduce uncertainties in future projections using Bayesian approaches, and refine emission scenarios. Future reports will also address critical thresholds for large-scale reorganizations in Earth systems and the effectiveness of carbon dioxide removal techniques.","Science, Impacts, Policies and Measures, Carbon Capture, New Reports",https://www.linkedin.com/posts/robert-vautard-8909171aa_my-ipcc-journal-national-weather-services-activity-7327216263397609472-hQeN
Y,3mo,David Carlin,NGFS Short-Term Scenarios: A New Tool for Analyzing Climate Impacts on Financial Stability,"David Carlin announces the NGFS's new short-term scenarios, a publicly available tool from over 100 central banks and supervisors, designed to analyze near-term climate policy and climate change impacts on financial stability. The four scenarios illustrate that regional extreme weather causes temporary but material GDP losses, impacting the global economy, and delaying transition efforts increases economic costs and financial stress. These scenarios are well-suited for climate stress-testing and offer granular outputs across financial variables, sectors, and countries, representing a major advance in finance's toolkit for understanding climate-related risks within a policy-relevant timeframe.","Climate Risk, Economics, Policies and Measures, Risk Disclosure, New Reports",https://www.linkedin.com/posts/david-carlin7_ngfs-climate-climaterisk-activity-7328033931600039936-0_rg
Y,3mo,Mark Cliffe,Critique of NGFS Short-Term Climate Scenarios: Mired in 'Model-Land' and Understating Risks,"Mark Cliffe critiques the new NGFS short-term climate scenarios, calling them an 'important step' but still 'mired in 'model-land'' and bearing little resemblance to the real world. He identifies two essential problems: only one scenario integrates both physical and transition risks despite their near-inevitability, and the reliance on a single, smooth baseline narrative ignores real-world economic and political shocks. Cliffe argues that the NGFS structurally understates climate-related financial risks and opportunities by equating transition risk solely with carbon pricing, emphasizing that macro-financial volatility is also a primary cause, not just a consequence, of transition risk.","Climate Risk, Economics, Policies and Measures, Risk Disclosure, New Reports, Science",https://www.linkedin.com/feed/update/urn:li:activity:7328458462235967491/
Y,3mo,Michael P Totten,"Undermining Autocrats: The Power of Nonviolent Protest, Mockery, and Humor","Michael P Totten discusses Gene Sharp's playbook for overturning autocrats, emphasizing nonviolent protests and humor as effective strategies. Abstract arguments for democratic values are less effective than approaches like mockery and salacious humor, which put autocrats in a difficult position of either appearing ridiculous by cracking down or weak by ignoring them. Examples include Chinese internet puns used to mock censors and President Xi Jinping being mocked as Winnie-the-Pooh, leading to bans on Pooh bear images. The post highlights the 'sheer helplessness' of authoritarians against humor, irony, and sarcasm.","Political Science, Social Movements, Communication Strategy",No matching URL found in provided list.
Y,3mo,Joe Romm,"Renewables are Cheaper and Available Now, While Gas Costs Triple and Delays Mount","Joe Romm counters a narrative promoting natural gas for AI data centers by citing NextEra Energy CEO John Ketchum, who states that renewables are 'cheaper and available right now'. Ketchum highlights a threefold increase in gas plant construction costs and significant delays, projecting gas can only deliver one-sixth of the 460 GW needed by 2030, with renewables making up the majority. Romm also points out that US gas prices have risen significantly since earlier EIA analyses, due to increased LNG exports, and a labor shortage further exacerbates the challenges for gas projects.","Energy Transition, Economics, Business Impacts, Policies and Measures, Science",No matching URL found in provided list.
Y,3mo,Laszlo Varro,US Energy Market Crossroads: Solar Stock Plummets Amidst Trump's Tax Bill and Accelerating Power Demand,"Laszlo Varro discusses the plummeting solar stocks following the advancement of Trump's tax bill in the US House, which reveals a conservative 'blindspot' regarding solar's significant contribution to incremental power. He notes the belief that gas investment will compensate for solar shortfalls, despite gas plant manufacturers facing supply chain issues and inability to take new orders this decade due to prior 'rightsizing'. With US power demand dynamically accelerating, largely driven by AI, Varro suggests that if the solar shortfall is larger than policymakers expect and gas production doesn't rapidly increase, the US energy markets could face 'exiting times'.","Energy Transition, Economics, Policies and Measures, Business Impacts, Impacts",https://www.linkedin.com/posts/laszlo-varro-57123b3_solar-stocks-plummet-after-trumps-tax-bill-activity-7331556139169427456-tTwj/
Y,3mo,Toby Lockwood,EU Confirms CO2 Storage Obligations for Oil and Gas Producers,"Toby Lockwood announces the confirmation of significant obligations on EU oil and gas producers to develop CO2 storage capacity, inviting users to check CATF's CO2 storage tracker to compare company plans against binding targets. He highlights the landmark legislation and invites participation in a Brussels workshop to discuss its implementation for climate impact. A comment by Margriet Kuijper suggests the need for tradeable storage certificates, indicating a market-based approach to meeting these obligations.","Carbon Capture, Policies and Measures, Business Impacts, Economics",https://www.linkedin.com/posts/toby-lockwood-a570338b_the-scale-of-the-obligations-on-the-eus-activity-7331630092617400320-NinG
Y,3mo,Ivo Degn,Climate Farmers Exits Carbon Markets: A Call for Better Systems for Regenerative Agriculture,"Ivo Degn announces Climate Farmers' decision to exit carbon markets after years of pioneering soil carbon credits, attributing it to the market's misalignment with regenerative agriculture. He argues that carbon markets reward simplicity over the complexity and nuance of regenerative practices, with costly and inconsistent monitoring that excludes many farmers. The rules often ignore the dynamic reality of soil science, creating disincentives, and the pursuit of credibility comes at a cost, leading them to prioritize a 'better system' that values multiple ecosystem services and sees farmers as stewards. This shift is not an exit from their mission but a focus on building systems that truly contribute to diverse, family-owned farms.","Carbon Accounting, Offsets, Policies and Measures, Economics, Biodiversity",https://www.linkedin.com/posts/ivo-degn-50668658_time-to-talk-about-carbon-markets-after-activity-7331216362851201024-Kq1-
Y,3mo,Janet Ranganathan,Record-Breaking Tropical Forest Loss in 2024 Driven by Fires and Agriculture,"Janet Ranganathan reports a record-shattering loss of 6.7 million hectares of primary rainforest in the tropics in 2024, an 80% jump from 2023, with nearly half due to human-caused fires for agricultural land clearing. Non-fire related primary forest loss also increased by 14%, primarily due to conversion to agriculture, severely impacting Latin America. This widespread tree cover loss, including in boreal regions, is critical because tropical forests underpin livelihoods, carbon storage, water provision, and biodiversity, yet their services are often undervalued until lost. Addressing this requires simultaneous deployment of global, national, and subnational policies, financial incentives, and recognition of indigenous rights.","Biodiversity, Impacts, Policies and Measures, Economics, Science",https://www.linkedin.com/feed/update/urn:li:activity:7331996515667808257/
Y,3mo,Melissa Lindsay,Demystifying Corresponding Adjustments in Article 6 of the Paris Agreement,"Melissa Lindsay clarifies the confusion around Corresponding Adjustments (CAs) in Article 6 of the Paris Agreement, noting that while investors seek Letters of Authorization (LoAs), an LoA alone doesn't guarantee a CA or premium prices. She explains that projects outside a country's Nationally Determined Contribution (NDC) can be eligible for a CA if emissions are nationally reported, while projects inside an unconditional NDC generally don't qualify. Projects in conditional NDCs can request CAs, but supply is limited and dependent on a country's agreement for various uses (NDC, CORSIA, Voluntary Use). Critics in the comments highlight that CAs are for double counting, not additionality or environmental integrity, and there's confusion about tradable budgets and the distinction between the VCM and Article 6 compliance markets.","Carbon Accounting, Policies and Measures, Economics, Risk Disclosure",https://www.linkedin.com/posts/melissa-lindsay-46b0287_comment-demystifying-the-link-between-article-activity-7331533756052234241-hz2X
Y,4mo,Alexander Nevolin,Addressing the 'Piping Problem' in Climate Risk Models: Why Impacts Appear Muted,"Alexander Nevolin addresses why climate risk often appears 'not an issue' in models, attributing it to the 'piping' – how models are joined – rather than the models themselves. He illustrates this with the example of linking Integrated Assessment Models (IAMs) with Macro models, where a narrow connection using only a few parameters leads to climate impacts appearing muted in economic outcomes (inflation, growth). Crucially, there's often no feedback loop from the macroeconomy back to the IAM, creating a modeling artifact rather than reality. Nevolin urges scrutiny of these connections, as the field evolves towards more integrated models that seamlessly blend macroeconomic dynamics and technology diffusion.","Climate Risk, Economics, Science, Risk Disclosure",https://www.linkedin.com/posts/alexander-nevolin-0ba0105_another-reason-climate-risk-seems-like-not-activity-7323657242648453120-_6A1
Y,3mo,Ketan Joshi,Major Review of Climate Accounting Standards: The Dangers of Blurring Emissions and Avoided Impact,"Ketan Joshi highlights a critical review of climate accounting standards, particularly the Greenhouse Gas Protocol (GHG-P), warning against a push to blend measured emissions with 'avoided emissions' or 'measured action,' which risks rehashing the problems of carbon offsetting. He explains that 'market-based' accounting for electricity consumption, which allows companies to claim lower climate impact by financially supporting renewables, is problematic and often akin to the worst offsets, leading to under-reported emissions. Joshi argues that such blending weakens pressure on high-emitters, obscures transparency, and is being advocated by a coalition of tech companies, the 'Emissions First Partnership,' which could drastically reduce the costs and real impacts associated with emission reduction claims, ultimately distorting the true climate impact of rising power demand. He calls for improved accuracy and accountability in emissions measurement to ensure a clear picture of the problem.","Carbon Accounting, Offsets, Policies and Measures, Business Impacts, Risk Disclosure, Science",https://www.linkedin.com/pulse/why-you-should-pay-attention-major-review-climate-accounting-joshi-tocgf/
Y,3mo,Sebastian Manhart,EU Commission Explores €6 Billion Purchase Program for Permanent Carbon Removal Credits,"Sebastian Manhart announces that the EU Commission is exploring a potential €6 billion purchase program for permanent carbon removal (CDR) credits, aiming to generate demand for CDR in the 2025-2030 period. This initiative, targeting 5 Mt/year of permanent European CDR by 2030, offers various options from a European Buyers’ Club to a Centralized Procurement Agency, and could provide a real use case for CRCF credits expected to roll out in 2026. Manhart expresses optimism that this program could be a crucial vehicle to scale CDR in Europe.","Carbon Capture, Policies and Measures, Economics, New Reports",No matching URL found in provided list.
Y,2025-08-06,Joel Makower,Corporate Sustainability is Evolving Not Dying,"Makower synthesizes LinkedIn comments on his column, ""No, corporate sustainability is not dying."" The consensus is that sustainability is evolving from an idealistic, performative phase to a more pragmatic and operational one. It's becoming integrated into strategy, governance, and even executive compensation. Despite challenges like burnout and political pushback, there is quiet, steady progress being made by a resilient cohort of professionals.",Business Response;Communications;Psychology,https://www.linkedin.com/posts/makower_is-corporate-sustainability-dying-industry-activity-7358584086514315264-Wh-c
Y,2025-09-02,Lubomila Jordanova,Spain Mandates Carbon Reporting in New Climate Emergency Plan,"Spain has launched an ambitious national climate pact, making carbon reporting mandatory for companies. The plan follows devastating wildfires and accelerates the country's decarbonization timeline, aiming for 100% renewable electricity by 2050. Key measures include mandatory Scope 1 & 2 reporting from 2026, significant investment in solar and green hydrogen, and new construction limitations in high-risk areas. Spain is positioning itself as Europe's clean energy leader, creating both strategic imperatives and opportunities for businesses.",Policies and Measures;Business Impacts;Economics,https://www.linkedin.com/posts/ljordanova_climatechange-decarbonisation-spain-activity-7368937391241281536-uuDw
Y,2025-09-02,Behavior x Climate,Why Half a Degree of Warming Matters,"The post highlights the critical difference between 1.5°C and 2°C of global warming, using a WWF infographic to illustrate the escalating impacts. A 2°C world would see a 170% increase in flood risk, ice-free Arctic summers every decade, and 2 billion people exposed to heatwaves. The number of species at risk doubles or triples, and coral reefs would be virtually eliminated. The post emphasizes that every fraction of a degree is a lifeline for ecosystems and economies, urging immediate action from governments, businesses, and individuals.",Impacts;Science;Visualizations,https://www.linkedin.com/posts/behavior-x-climate_climatechange-netzero-sustainability-activity-7368930800399994881--SL-
Y,2025-09-02,Gavin Mooney,The Win-Win of Agrivoltaics: Combining Solar and Agriculture,"The post explores the benefits of agrivoltaics, the practice of using land for both solar energy and agriculture. Solar panels create microhabitats that benefit grazing animals like sheep, providing shade that reduces heat stress and promotes more nutritious forage. For agriculture, the shade reduces water evaporation and benefits certain crops, while for solar farms, animals manage vegetation, reducing maintenance and fire risk. This dual-land-use approach increases land yield, provides an additional income source for farmers, and is a clear win-win for energy and food security.",Solutions;Abundance;Business Response,https://www.linkedin.com/posts/gavinmooney_energy-sustainability-renewables-activity-7368881270350630915-k9dr
Y,2025-08-13,Andreas Rasche,Robust Sustainability Disclosures are a Necessity Not a Luxury,"Rasche quotes a Financial Times op-ed arguing against the EU's ""omnibus"" proposal to reduce the scope of the Corporate Sustainability Reporting Directive (CSRD). The post contends that descoping most companies from CSRD damages Europe's long-term competitiveness by creating data gaps for investors and regulators. This increases the risk that taxpayers will bear climate costs. The author advocates for meaningful simplification of rules, like the revised ESRS, rather than broad exemptions that undermine the core objectives of the directive.",Policies and Measures;Risk Disclosure;Economics,https://www.linkedin.com/posts/andreasrasche_omnibus-csrd-esrs-activity-7359233733935194112-X7MB
Y,2025-08-04,Nick Robins,A Tribute to Climate Diplomat Pete Betts and the Art of the Possible,"The post reflects on the posthumous book by Pete Betts, a long-time UK and EU climate diplomat. The book offers an insightful personal history of international climate negotiations and highlights Betts's significant impact on global cooperation. Robins shares Betts's final, poignant message, written weeks before his death, urging people to pursue ""the art of the possible"" and avoid turning climate into a culture war. The book serves as a testament to Betts's conviction and the importance of dedicated diplomacy in addressing the climate crisis.",Communications;Psychology;Policies and Measures,https://www.linkedin.com/posts/nick-robins-5293a715_theclimatediplomat-activity-7357821883649589249-gL72
Y,2025-09-02,Ingmar Rentzhog,The Vatican's Shift from Silencing Science to Championing Climate Action,"This post contrasts the Vatican's historical silencing of Galileo with its modern role in elevating climate science. It highlights the recent Vatican Resilience Summit, which brought together leaders and scientists to focus on evidence and humanity. The author argues that when an institution with the Vatican's moral reach supports science, it can mobilize millions. The post includes a short documentary from the summit, emphasizing the need to unite around science to secure our common future and #MakeScienceGreatAgain.",Communications;Psychology;Science,https://www.linkedin.com/posts/rentzhog_vatican-makesciencegreatagain-wedonthavetime-ugcPost-7368725952266170370-oX-J
Y,2025-09-02,Carl Bärstad,Satirical Hit Piece Exposes Norway's Climate Hypocrisy,"The post shares a political satire video by The Juice Media that critiques Norway's image as a climate leader. The video highlights the contradiction between Norway's high EV adoption and renewable energy use and its status as a major petro-state aggressively expanding oil and gas extraction. The satire points out that Norway's sovereign wealth fund invests in fossil fuels, and the state-owned company Equinor engages in ""petroganda."" The post argues that despite its green reputation, Norway's economy is deeply entangled with fossil fuels, undermining its climate efforts.",Communications;Policies and Measures;Economics,https://www.linkedin.com/posts/carlbarstad_absolutely-brilliant-political-satire-hit-activity-7368585847555665922-IrGm
Y,2025-08-04,Gabriel L.,Aviation's Decarbonization Narrative Faces a Reckoning,"The author argues that the recent decision by Boeing and Airbus to pause green aircraft projects is a long-overdue reality check for the aviation industry. The post contends that technologies like hydrogen are technically immature and economically implausible for large-scale air travel, and Sustainable Aviation Fuel (SAF) is nowhere near the scale required. With no viable zero-emission aircraft on the horizon, the industry's net-zero commitments lack credibility. The author concludes that demand restraint may be the only effective lever left, which will likely be forced upon the industry by regulation and investor pressure.",Business Impacts;Solutions;Economics,https://www.linkedin.com/posts/laeragabriel_boeing-and-airbus-ground-green-plane-projects-activity-7358323564065820674-jW1k
Y,2025-08-13,Justin Moran,"Why ""Breaking the Link with Gas"" Isn't Simple for Electricity Prices","This post addresses the common suggestion that Irish electricity prices could be easily reduced by ""breaking the link with the price of gas."" Moran explains that the current market system, where the most expensive generator (often gas) sets the price for all, is designed to ensure a reliable electricity supply. While this means renewables can earn high profits, it also incentivizes investment in cheaper, cleaner energy. The author argues that simply changing this marginal pricing model is more complicated than it sounds and could have unintended consequences for market stability and the energy transition.",Economics;Policies and Measures;Solutions,https://www.linkedin.com/posts/justin-moran-281ab220_breaking-up-with-gas-its-a-bit-more-complicated-activity-7359581376284688384-GGX0
Y,2025-08-06,Dave Sawyer,A State of Play on Canada's Climate Policy,"Sawyer provides an overview of Canada's progress toward its 2030 GHG target. While emissions are down 8% since 2005 and electricity emissions have dropped nearly 60%, these gains are being wiped out by a 150% increase in emissions from the oil sands. The post notes that recent policy rollbacks and a focus on unproven technologies like CCUS are putting the national plan off track. Sawyer argues for strengthening what works (like pricing and regulations), improving federal-provincial coordination, and focusing on scaling proven clean technologies rather than chasing short-term noise.",Policies and Measures;Economics;Business Impacts,https://www.linkedin.com/posts/dave-sawyer-1ab35762_a-state-of-play-climate-policy-ramble-i-activity-7358988188373110785-PiZT
Y,2025-08-06,John Lang,China's Clean Energy Exports Drive Global Decarbonization,"The post highlights a Carbon Brief analysis showing that China's clean energy exports in 2024 could cut over 4 billion tonnes of CO2 over their lifetimes. Despite legitimate concerns about subsidies and trade practices, the author argues that China's ""dumping"" of clean tech is accelerating the global energy transition and enabling lower-income nations to access cheap renewables. China dominates the manufacturing of solar panels, batteries, and EVs, and its overseas investments are expanding this footprint. This contrasts with the US, where political opposition to renewables threatens to leave an investment gap that China is poised to fill.",Economics;Policies and Measures;Solutions,https://www.linkedin.com/posts/john-langab_analysis-chinas-clean-energy-exports-in-activity-7358438477237002240-CVXL
